{
  "id": "catppuccin-macchiato",
  "label": "Catppuccin Macchiato",
  "scheme": "dark",
  "palette": {
    "paper": "#1e2030",
    "raised": "#363a4f",
    "sunk": "#24273a",
    "ink": "#cad3f5",
    "inkSoft": "#b8c0e0",
    "inkFaint": "#939ab7",
    "accent": "#c6a0f6",
    "accentBright": "#b7bdf8",
    "accentInk": "#181926",
    "neutral": "#6e738d",
    "ok": "#a6da95",
    "danger": "#ed8796",
    "attention": "#8aadf4"
  },
  "syntax": {
    "comment": { "color": "#939ab7", "fontStyle": ["italic"] },
    "punctuation": { "color": "#939ab7" },
    "operator": { "color": "#8bd5ca" },
    "bracket": { "color": "#cad3f5" },
    "variable": { "color": "#cad3f5" },
    "parameter": { "color": "#ee99a0", "fontStyle": ["italic"] },
    "property": { "color": "#cad3f5" },
    "attribute": { "color": "#eed49f" },
    "keyword": { "color": "#c6a0f6" },
    "languageVariable": { "color": "#cad3f5" },
    "tag": { "color": "#8aadf4" },
    "tagPunctuation": { "color": "#8bd5ca" },
    "function": { "color": "#8aadf4", "fontStyle": ["italic"] },
    "builtinFunction": { "color": "#ed8796", "fontStyle": ["italic"] },
    "type": { "color": "#eed49f", "fontStyle": ["italic"] },
    "builtinType": { "color": "#c6a0f6" },
    "string": { "color": "#a6da95" },
    "escape": { "color": "#f5bde6" },
    "interpolation": { "color": "#939ab7" },
    "number": { "color": "#f5a97f" }
  }
}
